{
  "$schema": "https://project-interop.dev/schemas/v1/project.schema.json",
  "version": "1",
  "name": "acme-api",
  "repo": "~/work/acme-api",
  "branch": "main",

  "launch": {
    "prompt": "You are working on the acme-api project. Do NOT read AGENTS.md or other convention files. Instead, use the project_context tool to retrieve project context and the search tool to discover available operations.",
    "promptFile": "launch-prompt.md",
    "env": {
      "PROJECT_NAME": "acme-api",
      "PROJECT_ENV": "development"
    }
  },

  "tools": {
    "my-proxy": {
      "allow": [
        "github_*",
        "linear_*",
        "datadog_search_logs",
        "datadog_list_monitors",
        "postgres_*",
        "slack_search_messages",
        "slack_post_message"
      ],
      "deny": [
        "github_delete_repo",
        "*_drop_*"
      ],
      "defaults": {
        "github_*": { "owner": "acme-corp", "repo": "acme-api" },
        "linear_*": { "team_id": "ENG" },
        "postgres_*": { "database": "acme_development" },
        "slack_*": { "channel": "#eng-backend" }
      }
    },
    "filesystem": {
      "allow": ["read_file", "list_directory", "search_files"],
      "deny": ["write_file", "delete_file"]
    }
  },

  "context": {
    "files": [
      "onboarding.md",
      "current-sprint-goals.md",
      "db-schema-notes.md"
    ],
    "repoIncludes": [
      "AGENTS.md",
      "docs/architecture.md",
      "docs/data-model.md"
    ],
    "maxBytes": 262144
  },

  "agents": {
    "maxConcurrent": 2,
    "roles": {
      "backend": {
        "description": "Backend feature implementation and API development",
        "toolOverrides": {
          "my-proxy": {
            "allow": ["github_*", "postgres_*", "datadog_*"]
          }
        }
      },
      "reviewer": {
        "description": "Code review and quality assurance",
        "toolOverrides": {
          "my-proxy": {
            "allow": ["github_get_*", "github_list_*", "github_search_*"],
            "deny": ["github_create_*", "github_update_*", "github_delete_*", "github_merge_*"]
          }
        },
        "contextOverrides": {
          "files": ["review-checklist.md"]
        }
      }
    }
  },

  "extensions": {
    "com.example.workspace-mgr": {
      "gui": ["firefox https://app.acme.com"],
      "layout": "tile"
    }
  }
}
